[
  {
    "exercise_title": "Abort a merge",
    "exercise_description": [
      "While working on a branch, I initiated a merge.",
      "I am presented with merge prompt screen, but now I wish to abort the operation."
    ],
    "command_history": [
      "git merge"
    ],
    "script": "abort_a_merge.sh",
    "hints": [
      "Read the instructions on the merge prompt screen carefully.",
      "What happens if you close the terminal window without any changes ?",
      "What happens if you delete the commit message ?"
    ],
    "expected": {
      "explanations": [
        "The user should have properly aborted the merge. No merge commits should be present in the history."
      ]
    }
  },
  {
    "exercise_title": "Accidental Merge",
    "exercise_description": [
      "I worked on a feature and I wanted to rebase upon main",
      "But instead I did a merge"
    ],
    "command_history": [
      "git merge"
    ],
    "script": "accidental_merge.sh",
    "hints": [
    ],
    "expected": {
      "explanations": []
    }
  },
  {
    "exercise_title": "Rebase Conflict Resolution",
    "exercise_description": [
      "I edited the text1.txt file",
      "I want to rebase my feat branch onto main",
      "But another user edited the same file on main"
    ],
    "command_history": [
      "git rebase main"
    ],
    "script": "rebase_conflict.sh",
    "hints": [
      "When conflicts occur during rebase, git will pause and show you the conflicted files.",
      "Edit the conflicted files to resolve merge conflicts manually.",
      "After resolving conflicts, use 'git add' to mark files as resolved.",
      "Continue the rebase process with 'git rebase --continue'.",
      "If you want to abort the rebase, use 'git rebase --abort'."
    ],
    "expected": {
      "explanations": [
        "The user should successfully resolve the conflict and complete the rebase, resulting in a clean linear history with the feat branch rebased onto main."
      ]
    }
  },
  {
    "exercise_title": "Accidental Commit of Sensitive Data",
    "exercise_description": [
      "I accidentally committed my password to the repo",
      "I want to completely remove any mention of my password from the history"
    ],
    "command_history": [
    ],
    "script": "accidentally_commited_password.sh",
    "hints": [
      "Use 'git lg' to view the commit history",
      "On what branches is it present ?",
      "How do you remove the commit from both local and remote branch ?",
      "How about the git objects ?"
    ],
    "expected": {
      "script": "for f in $(find .git/objects -type f | sed -e 's|.git/objects||g' -e 's|/||g'); do git cat-file -p $f; done | grep 'pa$$word'",
      "explanations": [
        "The user should have successfully removed the commit from the history. Check the git objects to ensure that password is no longer present in git's internals."
      ]
    }
  }
]
